{"contract_name":"official-document-scope-catalog","extractor_id":"repository-native-source-scope-v1","schema_version":"1.0","skill_id":"literature-to-dft-plan","subjects":[{"evidence_class":"repository-policy","expected_disposition":"not-applicable","origin_refs":[{"path":"skills/literature-to-dft-plan/SKILL.md","sha256":"23cb713b07ea7b4970d7c63c9c96729195eeb1f87c7d0d3dbb5976e1bca2abb7"},{"path":"skills/literature-to-dft-plan/references/maturity-matrix.json","sha256":"134bf4d37512b972e1cc73bb99fc59661255591fec90aca38de7dd1b290d52fa"}],"provider_input_ids":[],"statement":"The Skill remains development, non-routable, and no-positive-claim; its candidate plan is not an activated calculation input.","subject_id":"literature.lifecycle.development-only","subject_kind":"limitation"},{"evidence_class":"deterministic-tool-behavior","expected_disposition":"not-applicable","origin_refs":[{"path":"skills/literature-to-dft-plan/scripts/literature_plan_cli.py","sha256":"14c6e010e447971e4db7a3a33ae734cd29a19febb4fb77713ac63d36fe7173e6"},{"path":"skills/literature-to-dft-plan/SKILL.md","sha256":"23cb713b07ea7b4970d7c63c9c96729195eeb1f87c7d0d3dbb5976e1bca2abb7"}],"provider_input_ids":[],"statement":"The candidate processes only supplied bounded metadata and facts; it does not query a paper database, DOI resolver, publisher, network, scheduler, or scientific executable.","subject_id":"literature.boundary.offline-supplied-metadata","subject_kind":"workflow"},{"evidence_class":"repository-policy","expected_disposition":"not-applicable","origin_refs":[{"path":"skills/literature-to-dft-plan/references/source-and-license-policy.md","sha256":"9fed6c5ecb80c2a225a6ad96550c2362733cf90a8c5b63d7d4ff3572814c407e"},{"path":"skills/literature-to-dft-plan/references/official-source-index.json","sha256":"38428edeee00c1f3e9667f1e42d6b26ac3c6504a135492cf8284d1200deb78c8"}],"provider_input_ids":[],"statement":"Every non-synthetic real source requires an exact official-source-record reference and external authority resolution.","subject_id":"literature.source.real-record-required","subject_kind":"workflow"},{"evidence_class":"repository-policy","expected_disposition":"not-applicable","origin_refs":[{"path":"skills/literature-to-dft-plan/references/source-and-license-policy.md","sha256":"9fed6c5ecb80c2a225a6ad96550c2362733cf90a8c5b63d7d4ff3572814c407e"},{"path":"skills/literature-to-dft-plan/references/repository-interface-manual.md","sha256":"b95b3a4113e8036c559a73373143f81e703642c618449c268ee09bb4d688a245"}],"provider_input_ids":[],"statement":"A DOI, title, URL, citation string, or content hash is identity metadata and does not establish truth, authority, completeness, or redistribution permission.","subject_id":"literature.source.metadata-not-truth","subject_kind":"limitation"},{"evidence_class":"repository-policy","expected_disposition":"excluded","origin_refs":[{"path":"skills/literature-to-dft-plan/SKILL.md","sha256":"23cb713b07ea7b4970d7c63c9c96729195eeb1f87c7d0d3dbb5976e1bca2abb7"},{"path":"skills/literature-to-dft-plan/references/official-source-index.json","sha256":"38428edeee00c1f3e9667f1e42d6b26ac3c6504a135492cf8284d1200deb78c8"}],"provider_input_ids":[],"statement":"No finite universal literature corpus is defined, bundled, or claimed complete; the source inventory is bounded by each request.","subject_id":"literature.corpus.all-literature-excluded","subject_kind":"limitation"},{"evidence_class":"scientific-methodology","expected_disposition":"not-applicable","origin_refs":[{"path":"skills/literature-to-dft-plan/references/repository-interface-manual.md","sha256":"b95b3a4113e8036c559a73373143f81e703642c618449c268ee09bb4d688a245"},{"path":"skills/literature-to-dft-plan/references/official-source-index.json","sha256":"38428edeee00c1f3e9667f1e42d6b26ac3c6504a135492cf8284d1200deb78c8"}],"provider_input_ids":[],"statement":"A planned scientific fact remains tied to a bounded page, section, table, figure, or equivalent locator and retains source limitations.","subject_id":"literature.claim.bounded-fact-locator","subject_kind":"workflow"},{"evidence_class":"scientific-methodology","expected_disposition":"not-applicable","origin_refs":[{"path":"skills/literature-to-dft-plan/SKILL.md","sha256":"23cb713b07ea7b4970d7c63c9c96729195eeb1f87c7d0d3dbb5976e1bca2abb7"},{"path":"skills/literature-to-dft-plan/references/fail-closed-contract.md","sha256":"9f6e4e92e041ef26dc74c840e447381a3bcbcbe1d3a506ed1346053ce37f6070"}],"provider_input_ids":[],"statement":"Missing version-sensitive method or parameter evidence remains unknown and blocks promotion instead of being inferred from another version or source.","subject_id":"literature.plan.no-parameter-invention","subject_kind":"limitation"},{"evidence_class":"repository-policy","expected_disposition":"not-applicable","origin_refs":[{"path":"skills/literature-to-dft-plan/SKILL.md","sha256":"23cb713b07ea7b4970d7c63c9c96729195eeb1f87c7d0d3dbb5976e1bca2abb7"},{"path":"skills/literature-to-dft-plan/references/environment-and-authorization.md","sha256":"631c3be7bf4705b49fa16c8a88ca84a89b9cbb14b30636c9d0ecb02005e2657f"}],"provider_input_ids":[],"statement":"A human selects sources, methods, and scientific acceptance; the candidate does not authorize execution or publication claims.","subject_id":"literature.handoff.human-selection","subject_kind":"limitation"},{"evidence_class":"repository-policy","expected_disposition":"excluded","origin_refs":[{"path":"skills/literature-to-dft-plan/SKILL.md","sha256":"23cb713b07ea7b4970d7c63c9c96729195eeb1f87c7d0d3dbb5976e1bca2abb7"},{"path":"skills/literature-to-dft-plan/references/source-and-license-policy.md","sha256":"9fed6c5ecb80c2a225a6ad96550c2362733cf90a8c5b63d7d4ff3572814c407e"}],"provider_input_ids":[],"statement":"Article bodies, copied abstracts used as evidence, credentials, private paths, restricted potentials, and unpublished results are excluded.","subject_id":"literature.privacy.source-bodies-excluded","subject_kind":"limitation"},{"evidence_class":"official-provider-required","expected_disposition":"partial","origin_refs":[{"path":"skills/literature-to-dft-plan/references/source-catalog-repository-interfaces.json","sha256":"3766c333fb2d74d8e48d6d896074578548b06b1b145a4caddb4a988dde9b0b03"}],"provider_input_ids":["repository-contracts-literature-plan"],"statement":"The exact literature-to-dft-plan repository source-index receipt is the catalog-wide provider evidence for repository-interface provenance.","subject_id":"repository-interface.catalog-wide-provenance","subject_kind":"documented-claim"}]}
