{"contract_name":"official-document-scope-catalog","extractor_id":"repository-native-source-scope-v1","schema_version":"1.0","skill_id":"dft-review-response","subjects":[{"evidence_class":"repository-policy","expected_disposition":"not-applicable","origin_refs":[{"path":"skills/dft-review-response/SKILL.md","sha256":"9f57241d4bd5d29fe84f9aefb244dc1fc9d803def9398e2428dcf72bddb2cf59"},{"path":"skills/dft-review-response/references/maturity-matrix.json","sha256":"78e785c6724c9d97672866aa05383ba96d18687eb21cc8a156c65a49f4ac06b3"}],"provider_input_ids":[],"statement":"The Skill remains development, non-routable, and no-positive-claim; candidate outputs are not active review interfaces or submissions.","subject_id":"review.lifecycle.development-only","subject_kind":"limitation"},{"evidence_class":"deterministic-tool-behavior","expected_disposition":"not-applicable","origin_refs":[{"path":"skills/dft-review-response/scripts/review_response_cli.py","sha256":"a3a587ee43b7aca0abc32f03ef874b4118ab7c7bebc5a6fc2661d8801012dff4"},{"path":"skills/dft-review-response/references/environment-and-authorization.md","sha256":"c69ec1c8aefe5f17b43a3b0f02ad8b5767e252e33fcb9b644957d350e5a98562"}],"provider_input_ids":[],"statement":"The candidate processes bounded local JSON and writes one fresh candidate package; it does not edit a manuscript, contact a journal, send a response, or run scientific software.","subject_id":"review.boundary.local-json-only","subject_kind":"workflow"},{"evidence_class":"deterministic-tool-behavior","expected_disposition":"not-applicable","origin_refs":[{"path":"skills/dft-review-response/scripts/review_response_cli.py","sha256":"a3a587ee43b7aca0abc32f03ef874b4118ab7c7bebc5a6fc2661d8801012dff4"},{"path":"skills/dft-review-response/references/fail-closed-contract.md","sha256":"321ec70c5dacbeb088cb6f91dd9469b4daace71f1d4f296b0122d431bb823b7e"}],"provider_input_ids":[],"statement":"Stable no-follow reads, exact raw-byte hashes, and no-replace output publication are local deterministic controls.","subject_id":"review.identity.strict-no-overwrite","subject_kind":"workflow"},{"evidence_class":"repository-policy","expected_disposition":"not-applicable","origin_refs":[{"path":"skills/dft-review-response/references/repository-interface-manual.md","sha256":"29b26f82c201fa4c6cbde8abba54a12fda552fef42ec540fb54bcf52e3e6d261"},{"path":"skills/dft-review-response/references/official-source-index.json","sha256":"d20df9e4d4ff504bb7205d7927cb287a4ea5473030536ddfebdcc0089c76f61e"}],"provider_input_ids":[],"statement":"Each response point remains bound to exact claim-map, official-source, artifact, manuscript, and decision refs supplied by the production bundle.","subject_id":"review.evidence.claim-map-bound","subject_kind":"workflow"},{"evidence_class":"repository-policy","expected_disposition":"not-applicable","origin_refs":[{"path":"skills/dft-review-response/references/official-source-index.json","sha256":"d20df9e4d4ff504bb7205d7927cb287a4ea5473030536ddfebdcc0089c76f61e"},{"path":"skills/dft-review-response/references/repository-interface-manual.md","sha256":"29b26f82c201fa4c6cbde8abba54a12fda552fef42ec540fb54bcf52e3e6d261"}],"provider_input_ids":[],"statement":"The candidate does not create citation authority; every literature-dependent point retains its input-specific external source resolver and bounded locator.","subject_id":"review.authority.runtime-resolver-external","subject_kind":"limitation"},{"evidence_class":"repository-policy","expected_disposition":"excluded","origin_refs":[{"path":"skills/dft-review-response/references/official-source-index.json","sha256":"d20df9e4d4ff504bb7205d7927cb287a4ea5473030536ddfebdcc0089c76f61e"}],"provider_input_ids":[],"statement":"A universal journal, manuscript, or literature provider is excluded because authorities are input-specific and open ended.","subject_id":"review.authority.universal-provider-excluded","subject_kind":"limitation"},{"evidence_class":"deterministic-tool-behavior","expected_disposition":"not-applicable","origin_refs":[{"path":"skills/dft-review-response/scripts/review_response_cli.py","sha256":"a3a587ee43b7aca0abc32f03ef874b4118ab7c7bebc5a6fc2661d8801012dff4"},{"path":"skills/dft-review-response/references/fail-closed-contract.md","sha256":"321ec70c5dacbeb088cb6f91dd9469b4daace71f1d4f296b0122d431bb823b7e"}],"provider_input_ids":[],"statement":"Unsupported acceptance language and positive scientific claims remain blocked; fluent response prose cannot remove an evidence gap.","subject_id":"review.response.no-positive-unsupported","subject_kind":"limitation"},{"evidence_class":"scientific-methodology","expected_disposition":"not-applicable","origin_refs":[{"path":"skills/dft-review-response/references/point-by-point-playbook.md","sha256":"f54ca5935fae7732a335eed38518bd3cb33216566ba8a7f1d22e5acacd4bee5b"},{"path":"skills/dft-review-response/SKILL.md","sha256":"9f57241d4bd5d29fe84f9aefb244dc1fc9d803def9398e2428dcf72bddb2cf59"}],"provider_input_ids":[],"statement":"Responses preserve a point-by-point chain from reviewer issue to bounded evidence, change, limitation, and unresolved next action.","subject_id":"review.workflow.point-by-point","subject_kind":"workflow"},{"evidence_class":"repository-policy","expected_disposition":"not-applicable","origin_refs":[{"path":"skills/dft-review-response/SKILL.md","sha256":"9f57241d4bd5d29fe84f9aefb244dc1fc9d803def9398e2428dcf72bddb2cf59"},{"path":"skills/dft-review-response/references/environment-and-authorization.md","sha256":"c69ec1c8aefe5f17b43a3b0f02ad8b5767e252e33fcb9b644957d350e5a98562"}],"provider_input_ids":[],"statement":"Scientific acceptance, manuscript changes, reviewer-facing wording, and submission remain human decisions outside the candidate.","subject_id":"review.handoff.human-submit","subject_kind":"limitation"},{"evidence_class":"repository-policy","expected_disposition":"excluded","origin_refs":[{"path":"skills/dft-review-response/SKILL.md","sha256":"9f57241d4bd5d29fe84f9aefb244dc1fc9d803def9398e2428dcf72bddb2cf59"},{"path":"skills/dft-review-response/references/official-source-index.json","sha256":"d20df9e4d4ff504bb7205d7927cb287a4ea5473030536ddfebdcc0089c76f61e"}],"provider_input_ids":[],"statement":"Reviewer identity, journal text, manuscript content, credentials, private paths, restricted potentials, and unpublished result bodies are excluded from fixtures and source packs.","subject_id":"review.privacy.restricted-content-excluded","subject_kind":"limitation"},{"evidence_class":"official-provider-required","expected_disposition":"partial","origin_refs":[{"path":"skills/dft-review-response/references/source-catalog-repository-interfaces.json","sha256":"ca91ab7c293d7e6f62867cbe620e25364f169fbfd3af7ee6df867b9cf6275d31"}],"provider_input_ids":["repository-contracts-review-response"],"statement":"The exact dft-review-response repository source-index receipt is the catalog-wide provider evidence for repository-interface provenance.","subject_id":"repository-interface.catalog-wide-provenance","subject_kind":"documented-claim"}]}
