{"contract_name":"official-document-scope-catalog","extractor_id":"lobster-document-scope-v1","schema_version":"1.0","skill_id":"lobster-bonding-analysis","subjects":[{"evidence_class":"official-provider-required","expected_disposition":"partial","origin_refs":[{"path":"skills/lobster-bonding-analysis/references/official-sources.yaml","sha256":"9fac4e12cafd991a6ebba824831a297a821104b2204799d7f660cda6f6289d17"},{"path":"skills/lobster-bonding-analysis/references/official-sources-and-version-strategy.md","sha256":"809f067c4980faebd21010dd8479c57d5f67f2232a6953b074f3d5d1a6fbcf31"}],"provider_input_ids":["lobster-acs-method-literature"],"statement":"COHP and projected-COHP definitions require the provider-required ACS method-literature input and do not establish native syntax.","subject_id":"lobster-cohp-method-definition","subject_kind":"documented-claim"},{"evidence_class":"official-provider-required","expected_disposition":"partial","origin_refs":[{"path":"skills/lobster-bonding-analysis/references/official-sources.yaml","sha256":"9fac4e12cafd991a6ebba824831a297a821104b2204799d7f660cda6f6289d17"},{"path":"skills/lobster-bonding-analysis/references/official-sources-and-version-strategy.md","sha256":"809f067c4980faebd21010dd8479c57d5f67f2232a6953b074f3d5d1a6fbcf31"}],"provider_input_ids":["lobster-wiley-method-literature"],"statement":"The LOBSTER projection framework requires the provider-required Wiley method-literature input and remains distinct from 5.1.1 grammar.","subject_id":"lobster-framework-capability","subject_kind":"capability"},{"evidence_class":"official-provider-required","expected_disposition":"blocked","origin_refs":[{"path":"skills/lobster-bonding-analysis/SKILL.md","sha256":"4383e53214f82955faad2697f3ab5faeed37b7530567ca009dcc522cdbce9f01"},{"path":"skills/lobster-bonding-analysis/references/official-sources-and-version-strategy.md","sha256":"809f067c4980faebd21010dd8479c57d5f67f2232a6953b074f3d5d1a6fbcf31"},{"path":"skills/lobster-bonding-analysis/references/environment-license-boundary.md","sha256":"862564ef522ff4794675c35246462040bae7a6977beed0081e0ee434f6e35817"}],"provider_input_ids":["lobster-acs-method-literature","lobster-wiley-method-literature"],"statement":"LOBSTER 5.1.1 argv, lobsterin grammar, completion markers, output schemas, examples, and basis resources remain blocked after review of the bounded method-literature inputs because they require an authorized manual.","subject_id":"lobster-5-1-1-native-contract","subject_kind":"workflow"},{"evidence_class":"repository-policy","expected_disposition":"excluded","origin_refs":[{"path":"skills/lobster-bonding-analysis/SKILL.md","sha256":"4383e53214f82955faad2697f3ab5faeed37b7530567ca009dcc522cdbce9f01"},{"path":"skills/lobster-bonding-analysis/references/environment-license-boundary.md","sha256":"862564ef522ff4794675c35246462040bae7a6977beed0081e0ee434f6e35817"}],"provider_input_ids":[],"statement":"Synthetic fixtures and deterministic checks cannot authenticate native LOBSTER 5.1.1 formats or chemical-bonding conclusions.","subject_id":"lobster-synthetic-guard-boundary","subject_kind":"limitation"}]}
