{"contract_name":"official-document-scope-catalog","extractor_id":"repository-native-source-scope-v1","schema_version":"1.0","skill_id":"dft-reporting","subjects":[{"evidence_class":"repository-policy","expected_disposition":"not-applicable","origin_refs":[{"path":"skills/dft-reporting/SKILL.md","sha256":"ef786b816c26c750052ad28975c9a226c7080a46b5dc333a2d2de17ca081b81f"},{"path":"skills/dft-reporting/references/maturity-matrix.json","sha256":"e9222861dcc72bbe6ac6abced695cd2816759c93add8626844bd711c7a930e22"}],"provider_input_ids":[],"statement":"The Skill remains development, non-routable, and no-positive-claim; its candidate artifacts are not planned production contracts.","subject_id":"reporting.lifecycle.development-only","subject_kind":"limitation"},{"evidence_class":"deterministic-tool-behavior","expected_disposition":"not-applicable","origin_refs":[{"path":"skills/dft-reporting/scripts/reporting_cli.py","sha256":"211f1334b2b45177bda9f7ca12c6ce623c868e4ef10449d20f536d41bf378229"},{"path":"skills/dft-reporting/references/environment-and-authorization.md","sha256":"854df74c95ef89b844121dfdf959acbadfad88481ace907d950f01bfdf0f895e"}],"provider_input_ids":[],"statement":"The candidate reads bounded local JSON and writes only one caller-selected fresh JSON artifact; it does not contact a source, publisher, scheduler, or scientific executable.","subject_id":"reporting.boundary.local-json-only","subject_kind":"workflow"},{"evidence_class":"deterministic-tool-behavior","expected_disposition":"not-applicable","origin_refs":[{"path":"skills/dft-reporting/scripts/reporting_cli.py","sha256":"211f1334b2b45177bda9f7ca12c6ce623c868e4ef10449d20f536d41bf378229"},{"path":"skills/dft-reporting/references/fail-closed-contract.md","sha256":"61eb4f76ee4d7f566cf3751636b5c15bde3f987eb0073e516d0df03290f1face"}],"provider_input_ids":[],"statement":"Stable no-follow reads, exact raw-byte hashes, and no-replace output publication are local deterministic controls.","subject_id":"reporting.identity.strict-no-overwrite","subject_kind":"workflow"},{"evidence_class":"deterministic-tool-behavior","expected_disposition":"not-applicable","origin_refs":[{"path":"skills/dft-reporting/scripts/reporting_cli.py","sha256":"211f1334b2b45177bda9f7ca12c6ce623c868e4ef10449d20f536d41bf378229"},{"path":"skills/dft-reporting/references/fail-closed-contract.md","sha256":"61eb4f76ee4d7f566cf3751636b5c15bde3f987eb0073e516d0df03290f1face"}],"provider_input_ids":[],"statement":"A local positive upstream claim is blocked pending an external production bundle, and the candidate claim ceiling remains no_positive_claim.","subject_id":"reporting.claim.no-positive","subject_kind":"limitation"},{"evidence_class":"repository-policy","expected_disposition":"not-applicable","origin_refs":[{"path":"skills/dft-reporting/references/repository-interface-manual.md","sha256":"cb555a6d5820d9c34913f0ba84b889eaf7732e7e81978fc210d79207f6e63b9f"},{"path":"skills/dft-reporting/references/official-source-index.json","sha256":"970374920c4b9928fa17dd4532c7e88f6c2ee3c5c40839d6110e44c603564d6a"}],"provider_input_ids":[],"statement":"A bounded locator is required when an official-source record is used, but a DOI, URL, label, or locator alone does not authenticate authority, license, or source content.","subject_id":"reporting.citation.locator-metadata-only","subject_kind":"limitation"},{"evidence_class":"repository-policy","expected_disposition":"not-applicable","origin_refs":[{"path":"skills/dft-reporting/references/official-source-index.json","sha256":"970374920c4b9928fa17dd4532c7e88f6c2ee3c5c40839d6110e44c603564d6a"},{"path":"skills/dft-reporting/references/workflow-and-roles.md","sha256":"9de9b81c4e7ba5f5cdc75aa93fd95f474172f1e518079aafc8f0a668b30975d4"}],"provider_input_ids":[],"statement":"Each runtime official-source record names its own externally resolved authority; the reporting candidate does not fetch or replace that resolver.","subject_id":"reporting.authority.runtime-resolver-external","subject_kind":"limitation"},{"evidence_class":"repository-policy","expected_disposition":"excluded","origin_refs":[{"path":"skills/dft-reporting/references/official-source-index.json","sha256":"970374920c4b9928fa17dd4532c7e88f6c2ee3c5c40839d6110e44c603564d6a"}],"provider_input_ids":[],"statement":"A universal external reporting-document provider is deliberately excluded because the set of runtime cited authorities is input-specific and open ended.","subject_id":"reporting.authority.universal-provider-excluded","subject_kind":"limitation"},{"evidence_class":"deterministic-tool-behavior","expected_disposition":"not-applicable","origin_refs":[{"path":"skills/dft-reporting/scripts/reporting_cli.py","sha256":"211f1334b2b45177bda9f7ca12c6ce623c868e4ef10449d20f536d41bf378229"},{"path":"skills/dft-reporting/SKILL.md","sha256":"ef786b816c26c750052ad28975c9a226c7080a46b5dc333a2d2de17ca081b81f"}],"provider_input_ids":[],"statement":"A candidate package stays draft-only, not publication-ready, and cannot send an external message.","subject_id":"reporting.boundary.draft-only","subject_kind":"limitation"},{"evidence_class":"scientific-methodology","expected_disposition":"not-applicable","origin_refs":[{"path":"skills/dft-reporting/references/report-content-playbook.md","sha256":"7c04705ad2ad4808dd831aa9d2718180d684eea444e0bc675d0a1decc65374eb"},{"path":"skills/dft-reporting/SKILL.md","sha256":"ef786b816c26c750052ad28975c9a226c7080a46b5dc333a2d2de17ca081b81f"}],"provider_input_ids":[],"statement":"Claim-first reporting preserves adverse evidence, negative results, unknowns, and limitations instead of converting prose fluency into support.","subject_id":"reporting.workflow.adverse-evidence-preserved","subject_kind":"workflow"},{"evidence_class":"scientific-methodology","expected_disposition":"not-applicable","origin_refs":[{"path":"skills/dft-reporting/SKILL.md","sha256":"ef786b816c26c750052ad28975c9a226c7080a46b5dc333a2d2de17ca081b81f"},{"path":"skills/dft-reporting/references/workflow-and-roles.md","sha256":"9de9b81c4e7ba5f5cdc75aa93fd95f474172f1e518079aafc8f0a668b30975d4"}],"provider_input_ids":[],"statement":"Execution completion, numerical support, physical validity, human scientific acceptance, and release remain separate gates.","subject_id":"reporting.workflow.separate-gates","subject_kind":"limitation"},{"evidence_class":"repository-policy","expected_disposition":"excluded","origin_refs":[{"path":"skills/dft-reporting/SKILL.md","sha256":"ef786b816c26c750052ad28975c9a226c7080a46b5dc333a2d2de17ca081b81f"},{"path":"skills/dft-reporting/references/official-source-index.json","sha256":"970374920c4b9928fa17dd4532c7e88f6c2ee3c5c40839d6110e44c603564d6a"}],"provider_input_ids":[],"statement":"Credentials, private paths, restricted potentials, manuscript bodies, and unpublished source text are excluded from candidate packages.","subject_id":"reporting.privacy.restricted-content-excluded","subject_kind":"limitation"},{"evidence_class":"official-provider-required","expected_disposition":"partial","origin_refs":[{"path":"skills/dft-reporting/references/source-catalog-repository-interfaces.json","sha256":"881f7eef801fd9636be14b127fd513d0d0c99e88bb11d0f0777918a5c818fdbc"}],"provider_input_ids":["repository-contracts-reporting"],"statement":"The exact dft-reporting repository source-index receipt is the catalog-wide provider evidence for repository-interface provenance.","subject_id":"repository-interface.catalog-wide-provenance","subject_kind":"documented-claim"}]}
